### ISSUE TITLE
dashboard not working well

### ISSUE THREAD

**Issue by norman25** [cblakely/openwrt-elk-dashboard#2]
hi there
after installed i get not working dashboard and visualizations.
my router config 192.168.1.1 udp port 2514 logs enabled ipt_netflow, iptables-mod-netflow and kernel ipk installed.
syslog and netflow  working ok (tested by tcpdump)
tcpdump: verbose output suppressed, use -v or -vv for full protocol decode
listening on enp0s8, link-type EN10MB (Ethernet), capture size 262144 bytes
20:59:20.576860 IP 192.168.1.1.52509 > 192.168.1.115.2514: UDP, length 240
20:59:23.295647 IP 192.168.1.1.52509 > 192.168.1.115.2514: UDP, length 240
tcpdump: verbose output suppressed, use -v or -vv for full protocol decode
listening on enp0s8, link-type EN10MB (Ethernet), capture size 262144 bytes
20:46:59.408634 IP 192.168.1.1.39980 > 192.168.1.115.2055: NetFlow v9
20:47:59.067323 IP 192.168.1.1.39980 > 192.168.1.115.2055: NetFlow v9

in dashboard and visualize i see this warnings:
Could not locate that index-pattern-field (id: ip_ver.keyword)
Could not locate that index-pattern-field (id: nf_dst_port.keyword)
Could not locate that index-pattern-field (id: nf_protocol.keyword)
Could not locate that index-pattern-field (id: geoip.country_code3.keyword)
Could not locate that index-pattern-field (id: nf_src_ip.keyword)
in discovery i get a lots of  _grokparsefailure 
any workaround to solve this issues 
thank you
